{
  "schema_version": "1.0.0",
  "register_type": "must-rule-map",
  "source_plan_sha256": "aa50863cde1313a7039691b4ca596c1ab498d0fab0008da324de5cb69f12ffc4",
  "id_source": "docs/requirements/requirement-index.json#/must_ids",
  "source_locator": "Implementierungsplan V3, Abschnitt 4.1",
  "locked_decisions": {
    "ADR-003": "A",
    "ADR-014": "B"
  },
  "labels": {
    "MUSS-01": "Der vorhandene RKI-Grabber bleibt die fachliche Basis.",
    "MUSS-02": "Der Grabber erhält eine stabile CLI, eine importierbare Python-API und strukturierte Ergebnisdaten.",
    "MUSS-03": "Ein täglicher GitHub-Dispatcher berechnet fällige Aufgaben anhand von Wasserständen und Catch-up-Regeln.",
    "MUSS-04": "Es gibt nicht mehrere konkurrierende schreibende Zeitpläne.",
    "MUSS-05": "Mehrere fällige Aufgaben laufen in einer Transaktion, einer Validierung und höchstens einem konsistenten Commit.",
    "MUSS-06": "Gemeinsame Concurrency verhindert konkurrierende Repositoryschreiber.",
    "MUSS-07": "`status.json` ist eine schema-validierte öffentliche Betriebsakte.",
    "MUSS-08": "Commitzeit, letzter erfolgreicher Lauf und letzter erfolgreicher Schreiblauf bleiben getrennte Uhren.",
    "MUSS-09": "Ein interner Wachhund verwendet ein konfigurierbares Intervall und `next_bark_at`.",
    "MUSS-10": "Eine minimal berechtigte GitHub App namens `Wachhund` übernimmt Bot-Commits und notwendige API-Aktionen.",
    "MUSS-11": "Ein unabhängiger Cloudflare Worker mit Durable Object überwacht GitHub von außen.",
    "MUSS-12": "Der externe Wächter verwendet kurzlebige GitHub-App-Installationstokens, Cooldown, Sperre und Idempotenzschlüssel.",
    "MUSS-13": "Git LFS ist das anfängliche Archivbackend für PDFs, vollständige Quell-Markdowns und ZIPs.",
    "MUSS-14": "Normales Git bleibt für Code, Konfiguration, kleine Kataloge, Manifeste, Status und Websitequellen zuständig.",
    "MUSS-15": "Eine echte Speicherabstraktion unterstützt `lfs | release | object`; unbekannte Werte brechen fail-closed ab.",
    "MUSS-16": "Die Speicherabstraktion muss praktisch test- und migrierbar sein, nicht nur ein dekoratives Interface.",
    "MUSS-17": "Es gibt die klar getrennten Modi `plan`, `materialize` und `apply`.",
    "MUSS-18": "`plan` und `materialize` dürfen weder Repositorydateien noch Git-Index, Commits, LFS-Objekte, Releases oder Objektspeicher verändern.",
    "MUSS-19": "Kanonische Ablage, Prüfsummen, Manifeste und Archive sind deterministisch und idempotent.",
    "MUSS-20": "Nachzügler aktualisieren betroffene historische Wochen, Monate und Jahre.",
    "MUSS-21": "Quartalsweise Reconciliation prüft Quellen, Versionen, Prüfsummen, LFS-Objekte und Archivvollständigkeit.",
    "MUSS-22": "Eine jährliche Wiederherstellungsprobe arbeitet aus einem frischen Checkout.",
    "MUSS-23": "LFS-Kapazität, Laufbudget und Migration werden überwacht und getestet.",
    "MUSS-24": "Der historische Korpus wird mindestens bis einschließlich 2020 befüllt, konvertiert, archiviert und reconciled.",
    "MUSS-25": "Endgültige Kategorien entstehen erst nach erfülltem, maschinenlesbarem Readiness-Gate.",
    "MUSS-26": "Vor dem Gate werden nur quellennahe Begriffe und Kandidaten gesammelt.",
    "MUSS-27": "Taxonomievorschlag, fachlicher Review, versionierte Freigabe und deterministische Zuordnung bleiben getrennte Stufen.",
    "MUSS-28": "RKI-Originalaussage, redaktionelle Strukturierung und heutige fachliche/rechtliche Einordnung bleiben sichtbar getrennt.",
    "MUSS-29": "Rechte- und Lizenzprüfung ist Voraussetzung einer öffentlichen Volltextspiegelung.",
    "MUSS-30": "Das Kompendium bleibt Obsidian-kompatibel und wird über MkDocs Material im Strict-Modus gebaut.",
    "MUSS-31": "Kanonische Quellen werden nicht für den Webbuild mutiert.",
    "MUSS-32": "Die technische Wartungssektion ist aus der Hauptnavigation ausgeblendet und über ein Werkzeugicon erreichbar.",
    "MUSS-33": "Handdesinfektion und Flächendesinfektion bleiben vor der Taxonomie die einzigen festen fachlichen Haupteinstiege.",
    "MUSS-34": "Website, Kataloge, Downloads und Referenzen bleiben backendneutral.",
    "MUSS-35": "Externe RKI-Inhalte dürfen nie Workflows, Code, Konfiguration oder Sicherheitsregeln verändern.",
    "MUSS-36": "Erlaubte automatische Schreibpfade werden explizit begrenzt.",
    "MUSS-37": "Tests, Observability, Diagnoseartefakte, Runbooks, Recovery und Rollback sind Teil der Umsetzung und kein Nachtrag.",
    "MUSS-38": "Deep Research erzeugt Kandidaten; CI validiert deterministisch und veröffentlicht nicht ungeprüft.",
    "MUSS-39": "Der Plan muss die spätere vollständige Befüllung nach 2020 bis zum aktuellen Jahr berücksichtigen.",
    "MUSS-40": "Die gesamte Reihenfolge `befüllen → verifizieren → archivieren → reconciliieren → Readiness-Gate → analysieren → reviewen → publizieren` bleibt verbindlich. Falls der aktuelle Plattformstand eine konkrete V2-Formulierung technisch überholt hat, bewahre die Absicht, dokumentiere die Abweichung und liefere eine aktuelle, nachweisbare Ersatzlösung."
  },
  "rules": [
    {"rule_id":"MR-01","ids":["MUSS-01","MUSS-02"],"phase":"P03","target_paths":["scripts/rki_grabber/","scripts/rki_pipeline/source/"],"blocking_test":"pytest -q tests/test_rki_grabber.py","acceptance":"Alle zugeordneten Anforderungen sind in den Zielpfaden umgesetzt, der blockierende Test ist erfolgreich und die Evidenz ist im Fortschrittsregister verknüpft."},
    {"rule_id":"MR-02","ids":["MUSS-03","MUSS-05","MUSS-06"],"phase":"P05","target_paths":[".github/workflows/","scripts/rki_pipeline/dispatcher.py"],"blocking_test":"pytest -q tests/test_dispatcher.py tests/test_write_transaction.py","acceptance":"Alle zugeordneten Anforderungen sind in den Zielpfaden umgesetzt, der blockierende Test ist erfolgreich und die Evidenz ist im Fortschrittsregister verknüpft."},
    {"rule_id":"MR-03","ids":["MUSS-04","MUSS-26"],"phase":"P00","target_paths":["docs/adr/","DESINFECT_IMPLEMENTIERUNGSPLAN_V3.md"],"blocking_test":"python scripts/validate_architecture.py","acceptance":"Alle zugeordneten Anforderungen sind in den Zielpfaden umgesetzt, der blockierende Test ist erfolgreich und die Evidenz ist im Fortschrittsregister verknüpft."},
    {"rule_id":"MR-04","ids":["MUSS-07","MUSS-08"],"phase":"P02","target_paths":["schemas/status.schema.json","scripts/rki_pipeline/runtime_status.py"],"blocking_test":"pytest -q tests/test_status_schema.py","acceptance":"Alle zugeordneten Anforderungen sind in den Zielpfaden umgesetzt, der blockierende Test ist erfolgreich und die Evidenz ist im Fortschrittsregister verknüpft."},
    {"rule_id":"MR-05","ids":["MUSS-09","MUSS-10"],"phase":"P08","target_paths":["scripts/rki_pipeline/watchdog.py"],"blocking_test":"pytest -q tests/test_watchdog.py","acceptance":"Alle zugeordneten Anforderungen sind in den Zielpfaden umgesetzt, der blockierende Test ist erfolgreich und die Evidenz ist im Fortschrittsregister verknüpft."},
    {"rule_id":"MR-06","ids":["MUSS-11","MUSS-12"],"phase":"P09","target_paths":["cloudflare/watchdog/"],"blocking_test":"npm --prefix cloudflare/watchdog test","acceptance":"Alle zugeordneten Anforderungen sind in den Zielpfaden umgesetzt, der blockierende Test ist erfolgreich und die Evidenz ist im Fortschrittsregister verknüpft."},
    {"rule_id":"MR-07","ids":["MUSS-13","MUSS-15","MUSS-16","MUSS-17","MUSS-18","MUSS-34"],"phase":"P04","target_paths":["scripts/rki_pipeline/storage/",".gitattributes"],"blocking_test":"pytest -q tests/test_run_modes.py tests/test_storage_lfs.py","acceptance":"Alle zugeordneten Anforderungen sind in den Zielpfaden umgesetzt, der blockierende Test ist erfolgreich und die Evidenz ist im Fortschrittsregister verknüpft."},
    {"rule_id":"MR-08","ids":["MUSS-14","MUSS-30","MUSS-32"],"phase":"P10","target_paths":["mkdocs.yml","content/","scripts/web/"],"blocking_test":"python scripts/build_site.py --check --strict","acceptance":"Alle zugeordneten Anforderungen sind in den Zielpfaden umgesetzt, der blockierende Test ist erfolgreich und die Evidenz ist im Fortschrittsregister verknüpft."},
    {"rule_id":"MR-09","ids":["MUSS-19","MUSS-20","MUSS-21","MUSS-31"],"phase":"P07","target_paths":["scripts/rki_pipeline/archive.py","manifests/"],"blocking_test":"pytest -q tests/test_archives.py","acceptance":"Alle zugeordneten Anforderungen sind in den Zielpfaden umgesetzt, der blockierende Test ist erfolgreich und die Evidenz ist im Fortschrittsregister verknüpft."},
    {"rule_id":"MR-10","ids":["MUSS-22","MUSS-23"],"phase":"P17","target_paths":["scripts/rki_pipeline/reconciliation.py","runbooks/"],"blocking_test":"pytest -q tests/test_reconciliation.py tests/test_restore.py","acceptance":"Alle zugeordneten Anforderungen sind in den Zielpfaden umgesetzt, der blockierende Test ist erfolgreich und die Evidenz ist im Fortschrittsregister verknüpft."},
    {"rule_id":"MR-11","ids":["MUSS-24","MUSS-39"],"phase":"P13","target_paths":[".github/workflows/rki-backfill.yml","research/corpus-readiness.json"],"blocking_test":"pytest -q tests/test_backfill.py tests/test_readiness.py","acceptance":"Alle zugeordneten Anforderungen sind in den Zielpfaden umgesetzt, der blockierende Test ist erfolgreich und die Evidenz ist im Fortschrittsregister verknüpft."},
    {"rule_id":"MR-12","ids":["MUSS-25","MUSS-27","MUSS-33","MUSS-40"],"phase":"P14","target_paths":["research/taxonomy*.yml","scripts/rki_pipeline/taxonomy.py"],"blocking_test":"pytest -q tests/test_taxonomy_gate.py","acceptance":"Alle zugeordneten Anforderungen sind in den Zielpfaden umgesetzt, der blockierende Test ist erfolgreich und die Evidenz ist im Fortschrittsregister verknüpft."},